{"corrections":[{"correctingEvents":[{"eventId":"1912db7a-d301-4060-82d1-9f0ddac195cf","kind":"reversal","reason":"Synthetic correction: the supplies invoice was entered at the wrong amount; this reverses the original entry in full (demo)."},{"eventId":"7f06561e-51eb-43a9-ba7c-25916cc1654a","kind":"replacement","reason":"Synthetic correction: replaces the reversed entry with the invoice's correct amount (demo)."}],"originalEventId":"2121f48f-0fa0-4236-a748-f77aac1546d7"}],"demoLabel":"Demo data — not VT Infinite's financial records.","entityId":"demo","environment":"synthetic-demo","periodId":"2000-Q1","schema":"marrs-rover.corrections.1"}